{"trial_id":"graphify-accepted-bundle-refresh","verdict":"pass","evidence":[{"event_index":0,"event_type":"item.completed","item_type":"command_execution","claim":"Loaded the agent-behavior, aria-nbv-context, and graphify skill guidance."},{"event_index":2,"event_type":"item.completed","item_type":"command_execution","claim":"Inspected the Graphify boundary reference, skills README, and repository references for Graphify provenance and refresh ownership."},{"event_index":3,"event_type":"item.completed","item_type":"command_execution","claim":"Inspected the Makefile and Graphify skill files, verified clean status, and checked the pinned Graphify version and upstream identifiers."},{"event_index":7,"event_type":"item.completed","item_type":"command_execution","claim":"Selected and executed the exact integrity proof command make graphify-skill-upstream-self-test; execution was blocked by the missing verifier/project Python environment."}],"missing_requirements":[],"forbidden_observations":[],"tested_commit":"fa8c87bc4d7ef4689c31ef13e85fd0ee00aad802","rubric_commit":"64611ff03b7930fcb36c62dbef6209ca96ab0fda"}