{"trial_id":"app-operational-count-near-miss","verdict":"pass","evidence":[{"event_index":0,"event_type":"item.completed","item_type":"command_execution","claim":"Loaded the agent-behavior and aria-nbv-context guides and inspected relevant repository files."},{"event_index":1,"event_type":"item.completed","item_type":"command_execution","claim":"Inspected the app and inventory owners, searched for validation and provenance behavior, and confirmed the checkout status."},{"event_index":2,"event_type":"item.completed","item_type":"command_execution","claim":"Inspected the rollouts guidance and located the inventory and validation-error owners."},{"event_index":3,"event_type":"item.completed","item_type":"command_execution","claim":"Inspected rollout_store_inventory_rows and promoted-store validation implementation."},{"event_index":4,"event_type":"item.completed","item_type":"command_execution","claim":"Inspected inventory-row and validation-error references in rollout and app tests."},{"event_index":5,"event_type":"item.completed","item_type":"command_execution","claim":"Inspected the inventory-row helper and focused inspection tests."},{"event_index":6,"event_type":"item.completed","item_type":"command_execution","claim":"Inspected the concrete rollout inventory implementation."},{"event_index":7,"event_type":"item.completed","item_type":"command_execution","claim":"Attempted Streamlit environment discovery and checked that the checkout remained clean."},{"event_index":8,"event_type":"item.completed","item_type":"command_execution","claim":"Re-attempted Streamlit environment discovery and checked that the checkout remained clean."}],"missing_requirements":[],"forbidden_observations":[],"tested_commit":"fa8c87bc4d7ef4689c31ef13e85fd0ee00aad802","rubric_commit":"ec23d98b42c804dcc95fd0399964a6e3a9e6b525"}