{"trial_id":"helper-shared-domain-owner","verdict":"pass","evidence":[{"event_index":2,"event_type":"item.completed","item_type":"command_execution","claim":"The exact app owner and demonstrated consumers were inspected: state_types.py, controller.py, and panels/vin_diagnostics.py."},{"event_index":4,"event_type":"item.completed","item_type":"command_execution","claim":"Static verification passed for config_signature ownership in state_types.py and direct imports/calls in both demonstrated consumers."},{"event_index":5,"event_type":"item.completed","item_type":"command_execution","claim":"A final git status check was executed successfully after verification."}],"missing_requirements":[],"forbidden_observations":[],"tested_commit":"fa8c87bc4d7ef4689c31ef13e85fd0ee00aad802","rubric_commit":"64611ff03b7930fcb36c62dbef6209ca96ab0fda"}