{"trial_id":"human-intent-proposal-ineligible","verdict":"fail","evidence":[{"event_index":1,"event_type":"item.completed","item_type":"command_execution","claim":"The trial loaded the agent-behavior and aria-nbv-context skill guides."},{"event_index":3,"event_type":"item.completed","item_type":"command_execution","claim":"The trial read reviewed intent, the accepted scoped target-state specification, and relevant owner-routing material."},{"event_index":5,"event_type":"item.completed","item_type":"command_execution","claim":"The trial inspected docs/AGENTS.md, the Typst style owner, and the related specification for thesis-code link ownership."},{"event_index":9,"event_type":"item.completed","item_type":"command_execution","claim":"The trial verified the representative Typst contract by compiling docs/typst/thesis/sections/01-introduction.typ with draft links disabled and a code reference input, and checked checkout state."},{"event_index":6,"event_type":"item.completed","item_type":"command_execution","claim":"The trial checked git status and reported a clean checkout."}],"missing_requirements":["The expected proposal-routing owner/reference .agents/skills/agents-db/references/proposal-routing-fixtures.md was not read or otherwise evidenced.","The route therefore did not fully demonstrate the required agents-db proposal-ineligibility decision against the canonical routing fixture."],"forbidden_observations":[],"tested_commit":"3752c1181864aecf57a9b925fded5564249bc5e8","rubric_commit":"3f1401bbda64680cdd7a0e0503e4f96e7eea7cb7"}