{"trial_id":"config-factory-hot-path-near-miss","verdict":"fail","evidence":[{"event_index":0,"event_type":"item.completed","item_type":"command_execution","claim":"Read the agent-behavior and aria-nbv-context skill guides and searched repository guidance files."},{"event_index":1,"event_type":"item.completed","item_type":"command_execution","claim":"Read aria_nbv/AGENTS.md and aria_nbv/aria_nbv/vin/AGENTS.md and searched VIN-related owners and tests."},{"event_index":3,"event_type":"item.completed","item_type":"command_execution","claim":"Inspected SceneMyopic VIN implementation and focused VIN tests."},{"event_index":4,"event_type":"item.completed","item_type":"command_execution","claim":"Inspected EVL backbone construction/configuration and backbone_out usage across model, Lightning, oracle, and tests."},{"event_index":5,"event_type":"item.completed","item_type":"command_execution","claim":"Inspected the VIN forward path and caller-side materialization/pass-through sites."},{"event_index":6,"event_type":"item.completed","item_type":"command_execution","claim":"Checked repository status and captured exact line locations for the representative contract and its callers."}],"missing_requirements":["The required owner path .agents/skills/python-standards/references/general_conventions.md was not read or evidenced."],"forbidden_observations":[],"tested_commit":"fa8c87bc4d7ef4689c31ef13e85fd0ee00aad802","rubric_commit":"64611ff03b7930fcb36c62dbef6209ca96ab0fda"}