{"trial_id":"scoped-spec-settles-graphify-bundle","verdict":"fail","evidence":[{"event_index":1,"event_type":"item.completed","item_type":"command_execution","claim":"The agent-behavior, aria-nbv-context, and graphify skill guides were read."},{"event_index":6,"event_type":"item.completed","item_type":"command_execution","claim":"The accepted scoped specification was inspected for Graphify ownership and byte-identity requirements."},{"event_index":7,"event_type":"item.completed","item_type":"command_execution","claim":"The checkout remained clean after the read-only checks."}],"missing_requirements":["The required reviewed-intent owner path .agents/skills/agent-behavior/references/reviewed-intent.md was not observed as opened.","The trial did not demonstrate that general reviewed intent was unnecessary after locating the scoped specification."],"forbidden_observations":[".agents/references/human_owner_intent.md was used as a deciding requirements source.","The response characterized the decision as accepted through the human_owner_intent path, contrary to the required owner routing."],"tested_commit":"a121cd821f7748f979c2cddf0f7c3af0e0b6a5a7","rubric_commit":"1b63b3c040f7c8733d8a989f2d3a309703c4f3ef"}