{"trial_id":"app-scientific-metric-interpretation","verdict":"fail","evidence":[{"event_index":1,"event_type":"item.completed","item_type":"command_execution","claim":"The route inspected Streamlit, scientific explanation, RRI, and rollout-store surfaces."},{"event_index":2,"event_type":"item.completed","item_type":"command_execution","claim":"The route opened the app and rollout ownership guides and inspected the stored-rollouts page and inspection implementation."},{"event_index":6,"event_type":"item.completed","item_type":"command_execution","claim":"The route opened the RRI returns implementation, Zarr store, and Zarr contract."},{"event_index":7,"event_type":"item.completed","item_type":"command_execution","claim":"The targeted pytest validation was attempted but failed because pytest was unavailable."},{"event_index":8,"event_type":"item.completed","item_type":"command_execution","claim":"The checkout remained clean after the trial."}],"missing_requirements":["The passed-validation readiness verdict and one-sentence interpretation did not lead the response.","The required representative contract owner aria_nbv/aria_nbv/app/references/scientific-interpretation.md was not opened or identified.","The required equation owner docs/typst/shared/equations.typ was not opened or identified.","Runtime validation did not pass; the attempted pytest command failed because pytest was unavailable."],"forbidden_observations":["No forbidden invented units or links were observed.","No raw tables preceding interpretation were observed."],"tested_commit":"fa8c87bc4d7ef4689c31ef13e85fd0ee00aad802","rubric_commit":"ec23d98b42c804dcc95fd0399964a6e3a9e6b525"}