{"trial_id":"human-intent-proposal-eligible","verdict":"fail","evidence":[{"event_index":7,"event_type":"item.completed","item_type":"command_execution","claim":"The trial read the human-owner intent reference and related routing/spec files, but its reported exact owner was instead production code."},{"event_index":10,"event_type":"item.completed","item_type":"command_execution","claim":"Read-only verification confirmed the candidate-generation config factory and shared setup_target lifecycle owners, plus a clean checkout."}],"missing_requirements":["The exact target owner should have been .agents/references/human_owner_intent.md, not aria_nbv/aria_nbv/pose_generation/candidate_generation.py.","The proposal should have remained explicitly proposed without assigning the production implementation owner as the routing decision."],"forbidden_observations":[],"tested_commit":"3752c1181864aecf57a9b925fded5564249bc5e8","rubric_commit":"3f1401bbda64680cdd7a0e0503e4f96e7eea7cb7"}