{"trial_id":"helper-shared-domain-owner","verdict":"pass","evidence":[{"event_index":1,"event_type":"item.completed","item_type":"command_execution","claim":"Completed repository-wide search for config_signature and related app-controller/VIN symbols."},{"event_index":2,"event_type":"item.completed","item_type":"command_execution","claim":"Completed focused search for config_signature consumers and read the state_types.py, app, and test locations relevant to shared ownership."},{"event_index":6,"event_type":"item.completed","item_type":"command_execution","claim":"Completed git status and git diff --quiet verification with exit code 0, supporting the required clean-checkout condition."}],"missing_requirements":[],"forbidden_observations":[],"tested_commit":"64611ff03b7930fcb36c62dbef6209ca96ab0fda","rubric_commit":"64611ff03b7930fcb36c62dbef6209ca96ab0fda"}