{"trial_id":"scoped-spec-settles-graphify-bundle","verdict":"pass","evidence":[{"event_index":17,"event_type":"item.completed","item_type":"command_execution","claim":"The accepted scoped specification was read and identifies the settled Graphify bundle decision."},{"event_index":2,"event_type":"item.completed","item_type":"command_execution","claim":"The agent-behavior guide was read as the routing authority."},{"event_index":5,"event_type":"item.completed","item_type":"command_execution","claim":"The reviewed-intent reference was read as general reviewed guidance, not as the deciding requirements owner."},{"event_index":4,"event_type":"item.completed","item_type":"command_execution","claim":"The ARIA-specific Graphify boundary guide was read, supporting the owner split: the scoped specification settles the decision and aria-nbv-context owns routing."},{"event_index":26,"event_type":"item.completed","item_type":"command_execution","claim":"Bounded verification passed for Graphify version 0.9.48, the recorded upstream pin in the governing sources, no Graphify bundle diff, and a clean checkout."}],"missing_requirements":[],"forbidden_observations":[],"tested_commit":"bea876d39f172b1bd903d29bd641c82beb4797e2","rubric_commit":"bea876d39f172b1bd903d29bd641c82beb4797e2"}