{"trial_id":"helper-lowest-shared-domain-owner","verdict":"pass","evidence":[{"event_index":3,"event_type":"item.completed","item_type":"command_execution","claim":"Inspected oracle scoring, scene-RRI, target-RRI, and related tests, including shared helper references and call sites."},{"event_index":4,"event_type":"item.completed","item_type":"command_execution","claim":"Searched exact helper definitions/imports and recorded owner evidence in oracle/README.md and oracle/_scoring.py; checked final checkout status."},{"event_index":5,"event_type":"item.completed","item_type":"command_execution","claim":"Inspected scoring and scene-RRI tests plus shared call sites in scene_rri.py and target_rri.py."},{"event_index":7,"event_type":"item.completed","item_type":"command_execution","claim":"Confirmed the checkout status after verification."}],"missing_requirements":[],"forbidden_observations":[],"tested_commit":"a121cd821f7748f979c2cddf0f7c3af0e0b6a5","rubric_commit":"1b63b3c040f7c8733d8a989f2d3a309703c4f3ef"}