{"trial_id":"graphify-accepted-bundle-refresh","verdict":"pass","evidence":[{"event_index":3,"event_type":"item.completed","item_type":"command_execution","claim":"Inspected the relevant Makefile and .agents skill files for the Graphify maintenance route."},{"event_index":4,"event_type":"item.completed","item_type":"command_execution","claim":"Opened the canonical graphify-aria-boundary reference and the Graphify upstream-skill test, identifying the accepted bundle manifest owner and its exact verification contract."},{"event_index":6,"event_type":"item.completed","item_type":"command_execution","claim":"Inspected .agents/skills/README.md and the vendored Graphify bundle metadata."},{"event_index":8,"event_type":"item.completed","item_type":"command_execution","claim":"Verified the pinned local Graphify tree/blob provenance, tracked-file count, clean worktree, and clean bundle diff."}],"missing_requirements":[],"forbidden_observations":[],"tested_commit":"64611ff03b7930fcb36c62dbef6209ca96ab0fda","rubric_commit":"64611ff03b7930fcb36c62dbef6209ca96ab0fda"}