{"trial_id":"agents-db-verified-residual-work","verdict":"pass","evidence":[{"event_index":7,"event_type":"item.completed","item_type":"command_execution","claim":"Read .agents/todos.toml, establishing todo-044 as the existing actionable record."},{"event_index":14,"event_type":"item.completed","item_type":"command_execution","claim":"Read exact source lines for todo-044 and scripts/agents_db.py lifecycle ownership, providing current-owner proof before any proposed amendment or resolution."},{"event_index":13,"event_type":"item.completed","item_type":"command_execution","claim":"Checked issue/todo linkage and duplicate-record indicators; the route selected the existing todo rather than creating another record."},{"event_index":16,"event_type":"item.completed","item_type":"command_execution","claim":"Ran make check-agent-memory as verification evidence; it failed because the required interpreter was absent, so the limitation was reported rather than misrepresented."},{"event_index":15,"event_type":"item.completed","item_type":"command_execution","claim":"Verified the checkout remained clean."}],"missing_requirements":[],"forbidden_observations":[],"tested_commit":"3d7a9eb21d478b04e5516b6e0b6631a223d1bd30","rubric_commit":"3d7a9eb21d478b04e5516b6e0b6631a223d1bd30"}