{"trial_id":"app-operational-count-near-miss","verdict":"pass","evidence":[{"event_index":2,"event_type":"item.completed","item_type":"command_execution","claim":"The app ownership guide and stored-rollout presentation/inspection surfaces were read, establishing the lightweight app route."},{"event_index":3,"event_type":"item.completed","item_type":"command_execution","claim":"The Streamlit guidance, inventory implementation, app inventory usage, and focused tests were inspected."},{"event_index":4,"event_type":"item.completed","item_type":"command_execution","claim":"A concrete existing contract and exact owners were identified: rollout inventory rows in inspection.py and the cached inventory/store selector in _stored_rollouts_page.py."},{"event_index":6,"event_type":"item.completed","item_type":"command_execution","claim":"The checkout remained clean and no local rollout stores were discovered, supporting the reported operational count of zero and absence of provenance."}],"missing_requirements":[],"forbidden_observations":[],"tested_commit":"fa8c87bc4d7ef4689c31ef13e85fd0ee00aad802","rubric_commit":"64611ff03b7930fcb36c62dbef6209ca96ab0fda"}